{
  "schema": "minimal_kernel.runtime_session_witness_inspect_compare_consumer/v0",
  "kind": "minimal_kernel.runtime_session_witness_inspect_compare_consumer",
  "generated_at_utc": "2026-05-05T00:00:00Z",
  "generator": "scripts/export_minimal_kernel_runtime_session_witness_inspect_compare_consumer.py",
  "result": "ok",
  "compare_consumer": {
    "title": "Minimal Kernel Runtime Session Witness Inspect Compare Consumer",
    "summary": "A thin consumer handoff that turns session-witness inspect compare drift into ordered explainable focus entries."
  },
  "artifact_context": {
    "source_compare_summary_path": "cmake-build-minimal-kernel-runtime-session-witness-inspect-compare-consumer-sample/source/session-witness.inspect.compare.summary.json",
    "output_root": "cmake-build-minimal-kernel-runtime-session-witness-inspect-compare-consumer-sample/consumer",
    "consumer_summary_path": "cmake-build-minimal-kernel-runtime-session-witness-inspect-compare-consumer-sample/consumer/session-witness.inspect.compare.consumer.summary.json",
    "report_markdown_path": "cmake-build-minimal-kernel-runtime-session-witness-inspect-compare-consumer-sample/consumer/session-witness.inspect.compare.consumer.report.md",
    "check_text_path": "cmake-build-minimal-kernel-runtime-session-witness-inspect-compare-consumer-sample/consumer/session-witness.inspect.compare.consumer.check.txt"
  },
  "source_compare": {
    "source_result": "ok",
    "changed": true,
    "baseline_summary_path": "cmake-build-minimal-kernel-runtime-session-witness-inspect-compare-consumer-sample/source/baseline/summary.json",
    "candidate_summary_path": "cmake-build-minimal-kernel-runtime-session-witness-inspect-compare-consumer-sample/source/candidate/summary.json",
    "baseline_result": "ok",
    "current_result": "fail",
    "baseline_session_status": "standing",
    "current_session_status": "collapsed",
    "baseline_failure_domain": "",
    "current_failure_domain": "runtime",
    "runtime_regression_count": 2,
    "runtime_improvement_count": 0,
    "world_failure_code_delta_count": 1,
    "witness_failure_code_delta_count": 1,
    "violation_delta_count": 2
  },
  "consumer_status": {
    "result": "ok",
    "total_focus_count": 5,
    "changed_focus_count": 5,
    "actionable_focus_count": 5,
    "default_focus_id": "session-state-drift",
    "highest_severity": "critical",
    "runtime_regression_count": 2,
    "added_failure_code_count": 2,
    "added_missing_runtime_fact_count": 2,
    "added_violation_count": 2
  },
  "default_focus": {
    "focus_id": "session-state-drift",
    "focus_kind": "session_state_drift",
    "priority": 0,
    "severity": "critical",
    "changed": true,
    "headline": "Session state drifted standing -> collapsed",
    "reason": "result or session status no longer matches the baseline witness",
    "session_status_baseline": "standing",
    "session_status_current": "collapsed",
    "failure_domain_baseline": "",
    "failure_domain_current": "runtime",
    "runtime_regressions": [
      "task_syscall",
      "handoff_continuity"
    ],
    "runtime_improvements": [],
    "added_failure_codes": [],
    "removed_failure_codes": [],
    "added_missing_runtime_facts": [],
    "removed_missing_runtime_facts": [],
    "added_affected_focus": [],
    "removed_affected_focus": [],
    "added_violations": [],
    "removed_violations": [],
    "artifact_refs": [
      {
        "id": "source-compare-summary",
        "label": "source compare summary",
        "path": "cmake-build-minimal-kernel-runtime-session-witness-inspect-compare-consumer-sample/source/session-witness.inspect.compare.summary.json"
      },
      {
        "id": "current-summary",
        "label": "current witness summary",
        "path": "cmake-build-minimal-kernel-runtime-session-witness-inspect-compare-consumer-sample/source/candidate/summary.json"
      }
    ],
    "summary_lines": [
      "result ok -> fail",
      "session standing -> collapsed",
      "failure domain - -> runtime",
      "failure delta 1, ledger delta 3"
    ],
    "question_lines": [
      "Did the session collapse before runtime continuity recovered?",
      "Which runtime regression best explains the new session state?"
    ]
  },
  "focus_entries": [
    {
      "focus_id": "session-state-drift",
      "focus_kind": "session_state_drift",
      "priority": 0,
      "severity": "critical",
      "changed": true,
      "headline": "Session state drifted standing -> collapsed",
      "reason": "result or session status no longer matches the baseline witness",
      "session_status_baseline": "standing",
      "session_status_current": "collapsed",
      "failure_domain_baseline": "",
      "failure_domain_current": "runtime",
      "runtime_regressions": [
        "task_syscall",
        "handoff_continuity"
      ],
      "runtime_improvements": [],
      "added_failure_codes": [],
      "removed_failure_codes": [],
      "added_missing_runtime_facts": [],
      "removed_missing_runtime_facts": [],
      "added_affected_focus": [],
      "removed_affected_focus": [],
      "added_violations": [],
      "removed_violations": [],
      "artifact_refs": [
        {
          "id": "source-compare-summary",
          "label": "source compare summary",
          "path": "cmake-build-minimal-kernel-runtime-session-witness-inspect-compare-consumer-sample/source/session-witness.inspect.compare.summary.json"
        }
      ],
      "summary_lines": [
        "result ok -> fail",
        "session standing -> collapsed"
      ],
      "question_lines": [
        "Did the session collapse before runtime continuity recovered?"
      ]
    },
    {
      "focus_id": "runtime-regression",
      "focus_kind": "runtime_regression",
      "priority": 10,
      "severity": "high",
      "changed": true,
      "headline": "Runtime facts changed: regressed [task_syscall, handoff_continuity] improved [-]",
      "reason": "runtime fact drift is the smallest direct explanation surface",
      "session_status_baseline": "standing",
      "session_status_current": "collapsed",
      "failure_domain_baseline": "",
      "failure_domain_current": "runtime",
      "runtime_regressions": [
        "task_syscall",
        "handoff_continuity"
      ],
      "runtime_improvements": [],
      "added_failure_codes": [],
      "removed_failure_codes": [],
      "added_missing_runtime_facts": [],
      "removed_missing_runtime_facts": [],
      "added_affected_focus": [],
      "removed_affected_focus": [],
      "added_violations": [],
      "removed_violations": [],
      "artifact_refs": [],
      "summary_lines": [
        "regressed runtime facts: task_syscall, handoff_continuity",
        "improved runtime facts: none"
      ],
      "question_lines": [
        "Should runtime diagnosis start from the session runtime ledger?"
      ]
    },
    {
      "focus_id": "world-compare-drift",
      "focus_kind": "world_compare_drift",
      "priority": 20,
      "severity": "high",
      "changed": true,
      "headline": "World compare drift added failure taxonomy [tick_not_observed]",
      "reason": "world compare projected new session drift evidence",
      "session_status_baseline": "standing",
      "session_status_current": "collapsed",
      "failure_domain_baseline": "",
      "failure_domain_current": "runtime",
      "runtime_regressions": [],
      "runtime_improvements": [],
      "added_failure_codes": [
        "tick_not_observed"
      ],
      "removed_failure_codes": [],
      "added_missing_runtime_facts": [
        "task_syscall"
      ],
      "removed_missing_runtime_facts": [],
      "added_affected_focus": [
        "timer"
      ],
      "removed_affected_focus": [],
      "added_violations": [],
      "removed_violations": [],
      "artifact_refs": [],
      "summary_lines": [
        "world verdict collapsed -> drifted",
        "added failure codes: tick_not_observed",
        "added missing runtime facts: task_syscall"
      ],
      "question_lines": [
        "Did world compare add a new failure taxonomy that should be reviewed first?"
      ]
    },
    {
      "focus_id": "witness-compare-drift",
      "focus_kind": "witness_compare_drift",
      "priority": 30,
      "severity": "high",
      "changed": true,
      "headline": "Witness compare drift added failure taxonomy [thread_not_resumed]",
      "reason": "witness export compare exposed new collapse evidence",
      "session_status_baseline": "standing",
      "session_status_current": "collapsed",
      "failure_domain_baseline": "",
      "failure_domain_current": "runtime",
      "runtime_regressions": [],
      "runtime_improvements": [],
      "added_failure_codes": [
        "thread_not_resumed"
      ],
      "removed_failure_codes": [],
      "added_missing_runtime_facts": [
        "task_syscall"
      ],
      "removed_missing_runtime_facts": [],
      "added_affected_focus": [
        "scheduler"
      ],
      "removed_affected_focus": [],
      "added_violations": [],
      "removed_violations": [],
      "artifact_refs": [],
      "summary_lines": [
        "witness verdict collapsed -> collapsed",
        "added failure codes: thread_not_resumed",
        "added missing runtime facts: task_syscall"
      ],
      "question_lines": [
        "Should witness-export collapse be reviewed before deeper runtime details?"
      ]
    },
    {
      "focus_id": "violation-drift",
      "focus_kind": "violation_drift",
      "priority": 40,
      "severity": "medium",
      "changed": true,
      "headline": "Violation drift changed [synthetic inspect compare drift, session runtime regressed]",
      "reason": "summary-level violations changed even after lower-level comparison completed",
      "session_status_baseline": "standing",
      "session_status_current": "collapsed",
      "failure_domain_baseline": "",
      "failure_domain_current": "runtime",
      "runtime_regressions": [],